Beginning benchmark: DEV=/dev/sda1 COUNT=100 DIR=/mnt/benchmark

/dev/sda1:

ATA device, with non-removable media
Standards:
	Likely used: 1
Configuration:
	Logical		max	current
	cylinders	0	0
	heads		0	0
	sectors/track	0	0
	--
	Logical/Physical Sector size:           512 bytes
	device size with M = 1024*1024:           0 MBytes
	device size with M = 1000*1000:           0 MBytes 
	cache/buffer size  = unknown
Capabilities:
	IORDY not likely
	Cannot perform double-word IO
	R/W multiple sector transfer: not supported
	DMA: not supported
	PIO: pio0 

NAME FSTYPE LABEL                      UUID                                 MOUNTPOINT
sda1 ext4   Fedora-AH-ostree-x86_64-27 e771fe43-d5a8-4ad4-91e8-270b989a292e /mnt

Disk /dev/sda1: 28.7 GiB, 30750951424 bytes, 60060452 sectors
Units: sectors of 1 * 512 = 512 bytes
Sector size (logical/physical): 512 bytes / 512 bytes
I/O size (minimum/optimal): 512 bytes / 512 bytes
